{
  "demand_estimate_id": "0192f3a1-7b2c-7d4e-8f90-610000000001",
  "version_no": 4,
  "period_start": "2026-11-01T00:00:00Z",
  "period_end": "2026-12-01T00:00:00Z",
  "confirmed_by": "analyst1",
  "clinic_share_version_id": "0192f3a1-7b2c-7d4e-8f90-620000000001",
  "lines": [
    {
      "clinic_id": 1,
      "component_kind": "RBC",
      "blood_group": "A+",
      "demand_volume_ml": 5400.25
    },
    {
      "clinic_id": 2,
      "component_kind": "CRYO",
      "demand_volume_ml": 120
    }
  ]
}
